{
  "$schema": "../../schema/adapter-profile.schema.json",
  "backend": "postgres",
  "capabilities": [
    "barriers",
    "cancel",
    "custom_schema",
    "deterministic_controls",
    "extensions",
    "fault_injection",
    "get",
    "insert",
    "job_crud",
    "leadership",
    "lifecycle",
    "maintenance",
    "migrate",
    "notifications",
    "periodic_jobs",
    "poll_only",
    "queues",
    "reset",
    "resumable_jobs",
    "retry",
    "scheduler",
    "subscriptions",
    "transactions",
    "unique_jobs",
    "work"
  ],
  "description": "Complete PostgreSQL compatibility: every method in contract.json and every complete manifest capability.",
  "methods": [
    "barrier_create",
    "barrier_release",
    "benchmark_enqueue",
    "cancel",
    "clock_set",
    "connection_count",
    "cron_next",
    "delete",
    "delete_finalized",
    "delete_many",
    "fault_disconnect_application",
    "fault_disconnect_listeners",
    "fault_expire_leader",
    "get",
    "handshake",
    "insert",
    "insert_many",
    "leader",
    "list",
    "listener_count",
    "migrate",
    "queue_add",
    "queue_get",
    "queue_list",
    "queue_pause",
    "queue_remove",
    "queue_resume",
    "queue_update",
    "raw_finalize",
    "raw_insert_exact_json",
    "raw_insert_full_row",
    "raw_insert_no_notify",
    "raw_job_exact_json",
    "raw_job_row",
    "raw_job_timestamps",
    "raw_notifications",
    "raw_replace_json_text",
    "raw_set_kind",
    "request_resign",
    "reset",
    "retry",
    "retry_delay",
    "rng_seed",
    "runtime_stats",
    "start",
    "stop",
    "tx_begin",
    "tx_cancel",
    "tx_commit",
    "tx_delete",
    "tx_delete_many",
    "tx_fail",
    "tx_get",
    "tx_insert",
    "tx_insert_many",
    "tx_list",
    "tx_queue_get",
    "tx_queue_list",
    "tx_queue_pause",
    "tx_queue_resume",
    "tx_queue_update",
    "tx_retry",
    "tx_rollback",
    "tx_update",
    "unique_key",
    "update",
    "wait",
    "work"
  ],
  "name": "postgres-full-v1",
  "protocol_revision": 1
}
