{
  "$schema": "../../schema/adapter-profile.schema.json",
  "backend": "sqlite",
  "capabilities": [
    "cancel",
    "deterministic_controls",
    "fast_insert",
    "get",
    "insert",
    "job_crud",
    "lifecycle",
    "migrate",
    "reset",
    "retry",
    "transactions",
    "unique_jobs"
  ],
  "description": "Backend-neutral job storage, insertion, and transaction compatibility on SQLite.",
  "methods": [
    "cancel",
    "clock_set",
    "cron_next",
    "delete",
    "delete_many",
    "get",
    "handshake",
    "insert",
    "insert_many",
    "insert_many_fast",
    "list",
    "migrate",
    "raw_insert_exact_json",
    "raw_job_exact_json",
    "raw_job_row",
    "raw_job_timestamps",
    "reset",
    "retry",
    "retry_delay",
    "rng_seed",
    "tx_begin",
    "tx_cancel",
    "tx_commit",
    "tx_delete",
    "tx_delete_many",
    "tx_get",
    "tx_insert",
    "tx_insert_many",
    "tx_insert_many_fast",
    "tx_list",
    "tx_retry",
    "tx_rollback",
    "tx_update",
    "unique_key",
    "update"
  ],
  "name": "portable-storage-v1",
  "protocol_revision": 1
}
